ID,Resume_str,Category,Name,dbscan_cluster
389,"Sneha Gupta

Objective: Passionate Quantum Computing professional seeking challenging roles.

Education: MBA in Technology Management from IIM Bangalore.

Experience: 12 years of hands-on experience in Quantum Computing.

Skills: Cirq, Qiskit, Q#, Quantum Circuits, VQE, Linear Algebra, Quantum Cryptography.

Projects: Project 1: Built a Quantum Computing solution using Linear Algebra, Quantum Circuits achieving significant improvement. Collaborated in a team of 3. Project 2: Built a Quantum Computing solution using Qiskit, Quantum Cryptography achieving significant improvement. Collaborated in a team of 4. Project 3: Built a Quantum Computing solution using Qiskit, VQE achieving significant improvement. Collaborated in a team of 2. Project 4: Built a Quantum Computing solution using Quantum Cryptography, Linear Algebra achieving significant improvement. Collaborated in a team of 3. 

Hackathons & Competitions: Participated in: Kaggle Competition, Google Solution Challenge, Flipkart GRiD. 

Certifications: NPTEL Programming in Python, AWS Certified Solutions Architect, Cisco CCNA. GitHub: https://github.com/snehagupta",Quantum Computing,Sneha Gupta,-1
390,"Sneha Williams

Objective: Passionate AR/VR Development professional seeking challenging roles.

Education: MBA in Technology Management from IIM Bangalore.

Experience: 3 years of hands-on experience in AR/VR Development.

Skills: ARKit, Spatial Computing, Unity, WebXR, OpenXR, Oculus SDK, 3D Modeling.

Projects: Project 1: Built a AR/VR Development solution using Oculus SDK, OpenXR achieving significant improvement. Collaborated in a team of 4. Project 2: Built a AR/VR Development solution using Unity, ARKit achieving significant improvement. Collaborated in a team of 4. Project 3: Built a AR/VR Development solution using Spatial Computing, 3D Modeling achieving significant improvement. Collaborated in a team of 5. Project 4: Built a AR/VR Development solution using WebXR, Spatial Computing achieving significant improvement. Collaborated in a team of 4. 

Hackathons & Competitions: Participated in: IEEE Xtreme. 

GitHub: https://github.com/snehawilliams",AR/VR Development,Sneha Williams,-1
391,"Aditya Iyer

Objective: Passionate Blockchain professional seeking challenging roles.

Education: B.Sc in Computer Applications from Madras University.

Experience: 12 years of hands-on experience in Blockchain.

Skills: NFT, Consensus Algorithms, Solidity, Hardhat, Ethereum.

Projects: Project 1: Built a Blockchain solution using NFT, Ethereum achieving significant improvement. Collaborated in a team of 2. Project 2: Built a Blockchain solution using Ethereum, Hardhat achieving significant improvement. Collaborated in a team of 3. Project 3: Built a Blockchain solution using Hardhat, Solidity achieving significant improvement. Collaborated in a team of 4. Project 4: Built a Blockchain solution using NFT, Hardhat achieving significant improvement. Collaborated in a team of 5. Project 5: Built a Blockchain solution using Hardhat, NFT achieving significant improvement. Collaborated in a team of 4. 

Hackathons & Competitions: Participated in: Flipkart GRiD. 

Certifications: Cisco CCNA, Microsoft Azure Fundamentals, Oracle Java SE Certification. GitHub: https://github.com/adityaiyer",Blockchain,Aditya Iyer,-1
392,"Vikram Joshi

Objective: Passionate Natural Language Processing professional seeking challenging roles.

Education: PhD in Machine Learning from IISc Bangalore.

Experience: 7 years of hands-on experience in Natural Language Processing.

Skills: Transformers, BERT, Hugging Face, spaCy.

Projects: Project 1: Built a Natural Language Processing solution using Transformers, BERT achieving significant improvement. Collaborated in a team of 2. 

Hackathons & Competitions: Participated in: Smart India Hackathon, Devfolio Hackathon, CodeChef Snackdown, NASA Space Apps Challenge. 

Certifications: Microsoft Azure Fundamentals, Coursera Deep Learning Specialization. GitHub: https://github.com/vikramjoshi",Natural Language Processing,Vikram Joshi,-1
393,"James Menon

Objective: Passionate Blockchain professional seeking challenging roles.

Education: B.Sc in Computer Applications from Madras University.

Experience: 10 years of hands-on experience in Blockchain.

Skills: Web3.js, Consensus Algorithms, Ethereum, DeFi, Hardhat, Rust, Solidity.

Projects: Project 1: Built a Blockchain solution using Ethereum, Web3.js achieving significant improvement. Collaborated in a team of 2. 

Hackathons & Competitions: Participated in: Kaggle Competition, HackWithInfy, Devfolio Hackathon, IEEE Xtreme. 

Certifications: NPTEL Programming in Python. GitHub: https://github.com/jamesmenon",Blockchain,James Menon,-1
394,"Suresh Das

Objective: Passionate Game Development professional seeking challenging roles.

Education: PhD in Machine Learning from IISc Bangalore.

Experience: 5 years of hands-on experience in Game Development.

Skills: Unreal Engine, C#, Unity, OpenGL.

Projects: Project 1: Built a Game Development solution using Unity, OpenGL achieving significant improvement. Collaborated in a team of 4. Project 2: Built a Game Development solution using Unity, OpenGL achieving significant improvement. Collaborated in a team of 3. 

Hackathons & Competitions: Participated in: IEEE Xtreme. 

Certifications: Cisco CCNA, AWS Certified Solutions Architect. GitHub: https://github.com/sureshdas",Game Development,Suresh Das,-1
395,"Sneha Reddy

Objective: Passionate Robotics professional seeking challenging roles.

Education: B.E. in Electronics from NIT Trichy.

Experience: 8 years of hands-on experience in Robotics.

Skills: Gazebo, Sensor Fusion, C++, SLAM, ROS, MATLAB.

Projects: Project 1: Built a Robotics solution using Gazebo, C++ achieving significant improvement. Collaborated in a team of 2. Project 2: Built a Robotics solution using ROS, MATLAB achieving significant improvement. Collaborated in a team of 5. Project 3: Built a Robotics solution using MATLAB, C++ achieving significant improvement. Collaborated in a team of 4. Project 4: Built a Robotics solution using SLAM, Sensor Fusion achieving significant improvement. Collaborated in a team of 5. 

Hackathons & Competitions: None.

Certifications: Cisco CCNA, AWS Certified Solutions Architect, Google Professional Data Engineer. GitHub: https://github.com/snehareddy",Robotics,Sneha Reddy,-1
396,"Arjun Verma

Objective: Passionate Web Development professional seeking challenging roles.

Education: B.Tech in Information Technology from Anna University.

Experience: 12 years of hands-on experience in Web Development.

Skills: Flask, HTML, REST API, Node.js, TypeScript, SQL, Django.

Projects: Project 1: Built a Web Development solution using Flask, REST API achieving significant improvement. Collaborated in a team of 4. Project 2: Built a Web Development solution using HTML, Flask achieving significant improvement. Collaborated in a team of 2. Project 3: Built a Web Development solution using REST API, SQL achieving significant improvement. Collaborated in a team of 4. Project 4: Built a Web Development solution using TypeScript, REST API achieving significant improvement. Collaborated in a team of 4. 

Hackathons & Competitions: Participated in: Devfolio Hackathon. 

Certifications: Oracle Java SE Certification, AWS Certified Solutions Architect. GitHub: https://github.com/arjunverma",Web Development,Arjun Verma,-1
397,"Vikram Das

Objective: Passionate Web Development professional seeking challenging roles.

Education: MBA in Technology Management from IIM Bangalore.

Experience: 10 years of hands-on experience in Web Development.

Skills: React, REST API, TypeScript, Flask.

Projects: Project 1: Built a Web Development solution using TypeScript, REST API achieving significant improvement. Collaborated in a team of 5. Project 2: Built a Web Development solution using Flask, REST API achieving significant improvement. Collaborated in a team of 3. Project 3: Built a Web Development solution using REST API, Flask achieving significant improvement. Collaborated in a team of 5. Project 4: Built a Web Development solution using REST API, TypeScript achieving significant improvement. Collaborated in a team of 3. Project 5: Built a Web Development solution using TypeScript, React achieving significant improvement. Collaborated in a team of 2. 

Hackathons & Competitions: Participated in: NASA Space Apps Challenge. 

GitHub: https://github.com/vikramdas",Web Development,Vikram Das,-1
398,"Karthik Gupta

Objective: Passionate Web Development professional seeking challenging roles.

Education: B.Sc in Computer Applications from Madras University.

Experience: 6 years of hands-on experience in Web Development.

Skills: JavaScript, TypeScript, React, Django, CSS, SQL, Flask, Node.js.

Projects: Project 1: Built a Web Development solution using Flask, CSS achieving significant improvement. Collaborated in a team of 5. Project 2: Built a Web Development solution using JavaScript, Node.js achieving significant improvement. Collaborated in a team of 4. Project 3: Built a Web Development solution using SQL, Django achieving significant improvement. Collaborated in a team of 5. Project 4: Built a Web Development solution using JavaScript, Flask achieving significant improvement. Collaborated in a team of 5. Project 5: Built a Web Development solution using Node.js, SQL achieving significant improvement. Collaborated in a team of 3. 

Hackathons & Competitions: None.

Certifications: Coursera Deep Learning Specialization. GitHub: https://github.com/karthikgupta",Web Development,Karthik Gupta,-1
399,"Vikram Joshi

Objective: Passionate Robotics professional seeking challenging roles.

Education: M.Tech in Artificial Intelligence from IIT Madras.

Experience: 11 years of hands-on experience in Robotics.

Skills: SLAM, Gazebo, MATLAB, Python, C++, Sensor Fusion, ROS, PID Control.

Projects: Project 1: Built a Robotics solution using Gazebo, PID Control achieving significant improvement. Collaborated in a team of 4. Project 2: Built a Robotics solution using MATLAB, Python achieving significant improvement. Collaborated in a team of 5. Project 3: Built a Robotics solution using Python, ROS achieving significant improvement. Collaborated in a team of 2. 

Hackathons & Competitions: Participated in: NASA Space Apps Challenge, HackerEarth Hackathon, Smart India Hackathon, ETHGlobal. 

Certifications: Cisco CCNA, Coursera Deep Learning Specialization. GitHub: https://github.com/vikramjoshi",Robotics,Vikram Joshi,-1
400,"Olivia Sharma

Objective: Passionate Natural Language Processing professional seeking challenging roles.

Education: B.Tech in Computer Science from VIT University.

Experience: 1 years of hands-on experience in Natural Language Processing.

Skills: NER, Summarization, Sentiment Analysis, Text Classification, Transformers, NLTK.

Projects: Project 1: Built a Natural Language Processing solution using Text Classification, Summarization achieving significant improvement. Collaborated in a team of 3. Project 2: Built a Natural Language Processing solution using Sentiment Analysis, Text Classification achieving significant improvement. Collaborated in a team of 5. Project 3: Built a Natural Language Processing solution using Text Classification, Sentiment Analysis achieving significant improvement. Collaborated in a team of 3. Project 4: Built a Natural Language Processing solution using Sentiment Analysis, Text Classification achieving significant improvement. Collaborated in a team of 3. Project 5: Built a Natural Language Processing solution using NLTK, NER achieving significant improvement. Collaborated in a team of 3. 

Hackathons & Competitions: None.

Certifications: Cisco CCNA, Coursera Deep Learning Specialization. GitHub: https://github.com/oliviasharma",Natural Language Processing,Olivia Sharma,-1
401,"Asha Nair

Objective: Passionate AR/VR Development professional seeking challenging roles.

Education: M.Sc in Data Science from BITS Pilani.

Experience: 10 years of hands-on experience in AR/VR Development.

Skills: WebXR, OpenXR, ARCore, Unity, Oculus SDK, ARKit, 3D Modeling, Spatial Computing.

Projects: Project 1: Built a AR/VR Development solution using Unity, ARKit achieving significant improvement. Collaborated in a team of 2. Project 2: Built a AR/VR Development solution using ARCore, OpenXR achieving significant improvement. Collaborated in a team of 4. Project 3: Built a AR/VR Development solution using WebXR, Oculus SDK achieving significant improvement. Collaborated in a team of 4. Project 4: Built a AR/VR Development solution using Oculus SDK, OpenXR achieving significant improvement. Collaborated in a team of 4. 

Hackathons & Competitions: Participated in: ETHGlobal, Facebook Hacker Cup, Smart India Hackathon, Devfolio Hackathon. 

Certifications: Cisco CCNA, NPTEL Programming in Python, Google Professional Data Engineer. GitHub: https://github.com/ashanair",AR/VR Development,Asha Nair,-1
402,"Mia Rao

Objective: Passionate Mobile Development professional seeking challenging roles.

Education: B.Tech in Information Technology from Anna University.

Experience: 0 years of hands-on experience in Mobile Development.

Skills: Retrofit, iOS, Swift, Android SDK, React Native.

Projects: Project 1: Built a Mobile Development solution using Android SDK, React Native achieving significant improvement. Collaborated in a team of 3. Project 2: Built a Mobile Development solution using React Native, Swift achieving significant improvement. Collaborated in a team of 4. 

Hackathons & Competitions: Participated in: ICPC, Devfolio Hackathon, NASA Space Apps Challenge, Smart India Hackathon. 

Certifications: Cisco CCNA. GitHub: https://github.com/miarao",Mobile Development,Mia Rao,-1
403,"Pooja Garcia

Objective: Passionate Blockchain professional seeking challenging roles.

Education: B.Tech in Computer Science from VIT University.

Experience: 12 years of hands-on experience in Blockchain.

Skills: Web3.js, Consensus Algorithms, Ethereum, Smart Contracts.

Projects: Project 1: Built a Blockchain solution using Ethereum, Consensus Algorithms achieving significant improvement. Collaborated in a team of 2. Project 2: Built a Blockchain solution using Smart Contracts, Ethereum achieving significant improvement. Collaborated in a team of 5. Project 3: Built a Blockchain solution using Consensus Algorithms, Ethereum achieving significant improvement. Collaborated in a team of 2. 

Hackathons & Competitions: Participated in: Facebook Hacker Cup. 

Certifications: NPTEL Programming in Python, Coursera Deep Learning Specialization, Microsoft Azure Fundamentals. GitHub: https://github.com/poojagarcia",Blockchain,Pooja Garcia,-1
404,"Sanjay Patel

Objective: Passionate Web Development professional seeking challenging roles.

Education: MBA in Technology Management from IIM Bangalore.

Experience: 7 years of hands-on experience in Web Development.

Skills: REST API, Flask, Node.js, HTML, Django, React, SQL, TypeScript.

Projects: Project 1: Built a Web Development solution using TypeScript, Django achieving significant improvement. Collaborated in a team of 5. Project 2: Built a Web Development solution using HTML, Node.js achieving significant improvement. Collaborated in a team of 3. Project 3: Built a Web Development solution using REST API, HTML achieving significant improvement. Collaborated in a team of 5. 

Hackathons & Competitions: Participated in: Microsoft Imagine Cup, MLH Local Hack Day, Facebook Hacker Cup. 

GitHub: https://github.com/sanjaypatel",Web Development,Sanjay Patel,-1
405,"Mohan Brown

Objective: Passionate DevOps professional seeking challenging roles.

Education: B.Sc in Computer Applications from Madras University.

Experience: 11 years of hands-on experience in DevOps.

Skills: Docker, Linux, Jenkins, Terraform, Git, Bash, AWS, Ansible.

Projects: Project 1: Built a DevOps solution using Ansible, Terraform achieving significant improvement. Collaborated in a team of 2. 

Hackathons & Competitions: Participated in: Microsoft Imagine Cup. 

GitHub: https://github.com/mohanbrown",DevOps,Mohan Brown,-1
406,"Lakshmi Williams

Objective: Passionate Game Development professional seeking challenging roles.

Education: M.Tech in Artificial Intelligence from IIT Madras.

Experience: 0 years of hands-on experience in Game Development.

Skills: Unreal Engine, OpenGL, Shader Programming, Blender, C#, Game AI, Physics Engine.

Projects: Project 1: Built a Game Development solution using C#, Shader Programming achieving significant improvement. Collaborated in a team of 4. Project 2: Built a Game Development solution using OpenGL, Game AI achieving significant improvement. Collaborated in a team of 4. Project 3: Built a Game Development solution using Shader Programming, Game AI achieving significant improvement. Collaborated in a team of 4. 

Hackathons & Competitions: None.

Certifications: AWS Certified Solutions Architect, NPTEL Programming in Python, Cisco CCNA. GitHub: https://github.com/lakshmiwilliams",Game Development,Lakshmi Williams,-1
407,"Olivia Brown

Objective: Passionate Cloud Computing professional seeking challenging roles.

Education: B.E. in Electronics from NIT Trichy.

Experience: 2 years of hands-on experience in Cloud Computing.

Skills: Azure, VPC, Lambda, S3, IAM.

Projects: Project 1: Built a Cloud Computing solution using IAM, S3 achieving significant improvement. Collaborated in a team of 3. Project 2: Built a Cloud Computing solution using IAM, Azure achieving significant improvement. Collaborated in a team of 2. 

Hackathons & Competitions: Participated in: HackWithInfy. 

GitHub: https://github.com/oliviabrown",Cloud Computing,Olivia Brown,-1
408,"Priya Nair

Objective: Passionate Network Engineering professional seeking challenging roles.

Education: B.Sc in Computer Applications from Madras University.

Experience: 1 years of hands-on experience in Network Engineering.

Skills: SDN, Cisco IOS, BGP, VLAN.

Projects: Project 1: Built a Network Engineering solution using SDN, Cisco IOS achieving significant improvement. Collaborated in a team of 5. Project 2: Built a Network Engineering solution using SDN, Cisco IOS achieving significant improvement. Collaborated in a team of 2. Project 3: Built a Network Engineering solution using VLAN, Cisco IOS achieving significant improvement. Collaborated in a team of 4. Project 4: Built a Network Engineering solution using SDN, VLAN achieving significant improvement. Collaborated in a team of 2. 

Hackathons & Competitions: Participated in: MLH Local Hack Day, Microsoft Imagine Cup. 

Certifications: Google Professional Data Engineer. GitHub: https://github.com/priyanair",Network Engineering,Priya Nair,-1
409,"Liam Reddy

Objective: Passionate DevOps professional seeking challenging roles.

Education: B.E. in Electronics from NIT Trichy.

Experience: 10 years of hands-on experience in DevOps.

Skills: Jenkins, Kubernetes, Linux, AWS.

Projects: Project 1: Built a DevOps solution using Jenkins, Kubernetes achieving significant improvement. Collaborated in a team of 4. Project 2: Built a DevOps solution using Jenkins, AWS achieving significant improvement. Collaborated in a team of 4. 

Hackathons & Competitions: Participated in: Smart India Hackathon. 

Certifications: AWS Certified Solutions Architect, Cisco CCNA. GitHub: https://github.com/liamreddy",DevOps,Liam Reddy,-1
410,"James Verma

Objective: Passionate Cloud Computing professional seeking challenging roles.

Education: B.Tech in Information Technology from Anna University.

Experience: 8 years of hands-on experience in Cloud Computing.

Skills: AWS, VPC, IAM, GCP, Azure, S3, Load Balancer.

Projects: Project 1: Built a Cloud Computing solution using Azure, IAM achieving significant improvement. Collaborated in a team of 5. Project 2: Built a Cloud Computing solution using VPC, IAM achieving significant improvement. Collaborated in a team of 5. Project 3: Built a Cloud Computing solution using Load Balancer, AWS achieving significant improvement. Collaborated in a team of 2. 

Hackathons & Competitions: Participated in: Google Solution Challenge, NASA Space Apps Challenge, ICPC. 

Certifications: Google Professional Data Engineer, Oracle Java SE Certification. GitHub: https://github.com/jamesverma",Cloud Computing,James Verma,-1
411,"Pooja Garcia

Objective: Passionate Web Development professional seeking challenging roles.

Education: M.Tech in Artificial Intelligence from IIT Madras.

Experience: 11 years of hands-on experience in Web Development.

Skills: SQL, React, HTML, Flask, JavaScript.

Projects: Project 1: Built a Web Development solution using Flask, JavaScript achieving significant improvement. Collaborated in a team of 4. 

Hackathons & Competitions: Participated in: Facebook Hacker Cup, IEEE Xtreme, Kaggle Competition. 

Certifications: Google Professional Data Engineer, AWS Certified Solutions Architect. GitHub: https://github.com/poojagarcia",Web Development,Pooja Garcia,-1
412,"Divya Johnson

Objective: Passionate UI/UX Design professional seeking challenging roles.

Education: M.Sc in Data Science from BITS Pilani.

Experience: 3 years of hands-on experience in UI/UX Design.

Skills: Accessibility, Sketch, Design Systems, Figma.

Projects: Project 1: Built a UI/UX Design solution using Accessibility, Figma achieving significant improvement. Collaborated in a team of 5. Project 2: Built a UI/UX Design solution using Accessibility, Sketch achieving significant improvement. Collaborated in a team of 2. Project 3: Built a UI/UX Design solution using Accessibility, Sketch achieving significant improvement. Collaborated in a team of 4. Project 4: Built a UI/UX Design solution using Sketch, Design Systems achieving significant improvement. Collaborated in a team of 3. 

Hackathons & Competitions: Participated in: Microsoft Imagine Cup, ETHGlobal, HackerEarth Hackathon. 

GitHub: https://github.com/divyajohnson",UI/UX Design,Divya Johnson,-1
413,"Rahul Joshi

Objective: Passionate FinTech professional seeking challenging roles.

Education: B.E. in Electronics from NIT Trichy.

Experience: 6 years of hands-on experience in FinTech.

Skills: Algorithmic Trading, Python, Pandas, Risk Management, Regulatory Compliance, Quantlib.

Projects: Project 1: Built a FinTech solution using Pandas, Quantlib achieving significant improvement. Collaborated in a team of 2. Project 2: Built a FinTech solution using Regulatory Compliance, Algorithmic Trading achieving significant improvement. Collaborated in a team of 3. Project 3: Built a FinTech solution using Pandas, Python achieving significant improvement. Collaborated in a team of 5. Project 4: Built a FinTech solution using Quantlib, Risk Management achieving significant improvement. Collaborated in a team of 4. Project 5: Built a FinTech solution using Python, Quantlib achieving significant improvement. Collaborated in a team of 5. 

Hackathons & Competitions: Participated in: Smart India Hackathon. 

Certifications: Coursera Deep Learning Specialization, Cisco CCNA. GitHub: https://github.com/rahuljoshi",FinTech,Rahul Joshi,-1
414,"Mohan Reddy

Objective: Passionate Cloud Computing professional seeking challenging roles.

Education: PhD in Machine Learning from IISc Bangalore.

Experience: 2 years of hands-on experience in Cloud Computing.

Skills: CloudFormation, Serverless, GCP, VPC, Load Balancer, IAM, Lambda.

Projects: Project 1: Built a Cloud Computing solution using CloudFormation, VPC achieving significant improvement. Collaborated in a team of 2. Project 2: Built a Cloud Computing solution using IAM, Lambda achieving significant improvement. Collaborated in a team of 2. 

Hackathons & Competitions: Participated in: MLH Local Hack Day, IEEE Xtreme, CodeChef Snackdown, ETHGlobal. 

GitHub: https://github.com/mohanreddy",Cloud Computing,Mohan Reddy,-1
415,"Arjun Gupta

Objective: Passionate Web Development professional seeking challenging roles.

Education: M.Sc in Data Science from BITS Pilani.

Experience: 7 years of hands-on experience in Web Development.

Skills: React, CSS, Node.js, TypeScript, JavaScript, SQL, Flask.

Projects: Project 1: Built a Web Development solution using CSS, TypeScript achieving significant improvement. Collaborated in a team of 2. Project 2: Built a Web Development solution using JavaScript, SQL achieving significant improvement. Collaborated in a team of 3. Project 3: Built a Web Development solution using Flask, JavaScript achieving significant improvement. Collaborated in a team of 3. 

Hackathons & Competitions: Participated in: HackerEarth Hackathon, Flipkart GRiD, NASA Space Apps Challenge, ETHGlobal. 

Certifications: NPTEL Programming in Python, Google Professional Data Engineer, Oracle Java SE Certification. GitHub: https://github.com/arjungupta",Web Development,Arjun Gupta,-1
416,"Liam Singh

Objective: Passionate Mobile Development professional seeking challenging roles.

Education: B.Tech in Computer Science from VIT University.

Experience: 6 years of hands-on experience in Mobile Development.

Skills: Swift, React Native, MVVM, Flutter, Android SDK.

Projects: Project 1: Built a Mobile Development solution using Flutter, Android SDK achieving significant improvement. Collaborated in a team of 5. Project 2: Built a Mobile Development solution using React Native, Android SDK achieving significant improvement. Collaborated in a team of 2. 

Hackathons & Competitions: Participated in: HackWithInfy, NASA Space Apps Challenge, MLH Local Hack Day, ETHGlobal. 

Certifications: Microsoft Azure Fundamentals, NPTEL Programming in Python, Google Professional Data Engineer. GitHub: https://github.com/liamsingh",Mobile Development,Liam Singh,-1
